{
  "$schema": "https://json-schema.org/draft/2020-12/schema",
  "$id": "https://fenrua.ai/schemas/capability-register.v1.schema.json",
  "title": "Fenrua capability register v1",
  "type": "object",
  "additionalProperties": false,
  "required": ["schemaVersion", "lastReviewed", "sourceReferences", "capabilities"],
  "properties": {
    "schemaVersion": { "const": "fenrua.capability-register.v1" },
    "lastReviewed": { "type": "string", "format": "date" },
    "sourceReferences": {
      "type": "object",
      "additionalProperties": false,
      "required": ["companyIdentityId", "siteEvidenceId", "documentRegisterId"],
      "properties": {
        "companyIdentityId": { "type": "string", "minLength": 1 },
        "siteEvidenceId": { "type": "string", "minLength": 1 },
        "documentRegisterId": { "type": "string", "minLength": 1 }
      }
    },
    "capabilities": {
      "type": "array",
      "minItems": 1,
      "items": {
        "type": "object",
        "additionalProperties": false,
        "required": [
          "id",
          "name",
          "category",
          "lifecycle",
          "maturity",
          "availability",
          "summary",
          "interfaces",
          "claimIds",
          "evidenceIds",
          "limitations",
          "nonClaims",
          "dependencies",
          "owner",
          "lastReviewed",
          "promotionGate"
        ],
        "properties": {
          "id": { "type": "string", "pattern": "^capability\\.[a-z0-9-]+$" },
          "name": { "type": "string", "minLength": 1 },
          "category": { "type": "string", "minLength": 1 },
          "lifecycle": { "enum": ["planned", "active", "deprecated", "retired"] },
          "maturity": {
            "enum": [
              "research",
              "doctrine",
              "specification",
              "prototype",
              "reference-implementation",
              "beta",
              "production"
            ]
          },
          "availability": {
            "enum": ["not-available", "source-only", "local", "limited-preview", "generally-available"]
          },
          "summary": { "type": "string", "minLength": 1 },
          "interfaces": {
            "type": "array",
            "items": {
              "type": "object",
              "additionalProperties": false,
              "required": ["kind", "label", "target"],
              "properties": {
                "kind": {
                  "enum": ["public-route", "public-api", "command", "source-artifact", "agreement", "documentation"]
                },
                "label": { "type": "string", "minLength": 1 },
                "target": { "type": "string", "minLength": 1 }
              }
            }
          },
          "claimIds": { "type": "array", "items": { "type": "string", "minLength": 1 } },
          "evidenceIds": { "type": "array", "items": { "type": "string", "minLength": 1 } },
          "limitations": { "type": "array", "minItems": 1, "items": { "type": "string", "minLength": 1 } },
          "nonClaims": { "type": "array", "minItems": 1, "items": { "type": "string", "minLength": 1 } },
          "dependencies": { "type": "array", "items": { "type": "string", "minLength": 1 } },
          "owner": { "type": "string", "minLength": 1 },
          "lastReviewed": { "type": "string", "format": "date" },
          "promotionGate": { "type": "string", "minLength": 1 },
          "productionEvidence": {
            "type": ["object", "null"],
            "additionalProperties": false,
            "required": ["runtimeEvidenceIds", "operationalEvidenceIds", "securityReviewEvidenceIds", "releaseDecisionEvidenceIds"],
            "properties": {
              "runtimeEvidenceIds": { "type": "array", "minItems": 1, "items": { "type": "string" } },
              "operationalEvidenceIds": { "type": "array", "minItems": 1, "items": { "type": "string" } },
              "securityReviewEvidenceIds": { "type": "array", "minItems": 1, "items": { "type": "string" } },
              "releaseDecisionEvidenceIds": { "type": "array", "minItems": 1, "items": { "type": "string" } }
            }
          }
        }
      }
    }
  }
}
